user_id,mutant_id,time_taken,status,decision,explanation,created_at,updated_at,maybe,no,yes,label_count,majority_decision,Maybe/No/Yes
97,1094,1,SUBMITTED,no,the mutant ois just casting a 'NumberFormat' as a 'NumberFormat',1.71907E+12,1.71908E+12,0,2,0,2,no,0/2/0
120,1095,5,SUBMITTED,yes,one is new super one is new subclass,1.71895E+12,1.71895E+12,0,0,3,3,yes,0/0/3
123,1095,20,SUBMITTED,yes,"In the mutant, the function creates a new instance of the LogFormat. But in the original, it clones an existing object (with its state and fields) and casts it to the same type. In some situations, the code would behave the same especially when cloning an object immediatly after initializing it. But the code would behave differently if you're dependant on some value fields you're expecting to based on the clone object. But since the engineers inteded to use cloning rather than simple initialization, then the code would most likely change in behavior when removing it.",1.71918E+12,1.71918E+12,0,0,3,3,yes,0/0/3
105,1095,5,SUBMITTED,yes,"The original method creates a new LogFormat instance with the same state as the original instance by using super.clone(). The object's state is then preserved when it clones the formatter field to make sure the new instance has a copy of the formatter.

However, in the mutant version, the default constructor is used to create a new instance of LogFormat and initializes the object with default values (base 10, base label ""10"", and showBase set to true). This indicates that there is no preservation of the original LogFormat object's state. Instead, regardless of the original object's state, the new instance will always have the default settings. When the clone method is used, the altered behavior will cause the cloned object to have erroneous and maybe unexpected values for its fields, producing different results. Since the mutant cannot reproduce the original object's state, it produces a bug.",1.71841E+12,1.71841E+12,0,0,3,3,yes,0/0/3
97,1096,1,SUBMITTED,no,the mutant is just casting an object as an object,1.71904E+12,1.71904E+12,0,3,0,3,no,0/3/0
23,1096,2,SUBMITTED,no,"The mutant code type cast the cloned instance in Object. I think its better to type cast the instance, else where we want to use that object, might mismatch with the type we expect. So its NOT a buggy mutant.",1.71921E+12,1.71921E+12,0,3,0,3,no,0/3/0
126,1096,2,SUBMITTED,no,"Both code snippet essentially does same thing.  The slight difference is with the fact that in code snippet 2, the clone object is explicitly cast to Object before returning. We know that the method's return type is Object, therefore the explicit cast is redundant and does not change the behavior or output. ",1.71933E+12,1.71933E+12,0,3,0,3,no,0/3/0
14,1099,2,SUBMITTED,no,this.bins and bins same field,1.71916E+12,1.71916E+12,0,2,0,2,no,0/2/0
126,1099,1,SUBMITTED,no,"There is no local variable called bins in the method,hence both code snippets will behave the same and provide same result.",1.71915E+12,1.71915E+12,0,2,0,2,no,0/2/0
11,1104,1,SUBMITTED,no,Format doesn't chage code,1.7193E+12,1.7193E+12,0,2,0,2,no,0/2/0
97,1104,1,SUBMITTED,no,same code,1.71908E+12,1.71908E+12,0,2,0,2,no,0/2/0
17,1105,1,SUBMITTED,no,Type cast not needed. Code logic not changed,1.71921E+12,1.71921E+12,0,2,0,2,no,0/2/0
14,1105,1,SUBMITTED,no,casting an object to same type does not change value,1.71839E+12,1.71839E+12,0,2,0,2,no,0/2/0
14,1106,1,SUBMITTED,no,Unnecessary parenthesis added around expression.,1.71821E+12,1.71821E+12,0,3,0,3,no,0/3/0
116,1106,12,SUBMITTED,no,The mutant functions the same way as the original code without introducing a bug,1.71937E+12,1.71937E+12,0,3,0,3,no,0/3/0
125,1106,2,SUBMITTED,no,"The code format is different since they added parentheses for the if statement, though it functions the same, so the codes function the same, and thus, the mutant is not buggy.",1.71893E+12,1.71893E+12,0,3,0,3,no,0/3/0
14,1112,2,SUBMITTED,no,Implicit typecasting is done explicitly.,1.71847E+12,1.71847E+12,0,2,0,2,no,0/2/0
132,1112,20,SUBMITTED,no,"Integer works like int but its a class wrapper , after java 5 , we have auto boxing/unboxing of Integer to int , so it should work fine , although the mutated version returns Integer instead of int.",1.71913E+12,1.71913E+12,0,2,0,2,no,0/2/0
105,1114,10,SUBMITTED,no,"Based on the supplied index, the eraValueToText method in the original method retrieves the string value from the iEras array. Since the contents of the iEras array are already of type String, the mutant version adds a superfluous cast to String, although this cast has no effect on the method's functionality or behavior. The behavior of the method is unaffected by this mutation; hence, it does not introduce a bug. The method's output and functionality are the same as those of the original version. Because the method's accuracy and performance are unaffected by the superfluous cast, it's not buggy",1.71892E+12,1.71892E+12,0,2,0,2,no,0/2/0
97,1114,1,SUBMITTED,no,its not buggy because its just casting a string as a string,1.71898E+12,1.719E+12,0,2,0,2,no,0/2/0
11,1118,1,SUBMITTED,no,Swaping operands in multiplication operation won't change the results,1.71917E+12,1.71917E+12,0,2,0,2,no,0/2/0
97,1118,1,SUBMITTED,no,some code,1.71909E+12,1.7191E+12,0,2,0,2,no,0/2/0
122,1119,1,SUBMITTED,no,"Referencing the specific member attribute using ""this"" keyword in Java is not wrong, rather appreciated for clarity. So this is not a bug. ",1.71901E+12,1.71927E+12,0,2,0,2,no,0/2/0
105,1119,5,SUBMITTED,no,"The instance variable 'iUnitMillis' is returned directly in the original 'getUnitMillis' method. This keeps things simple and readable by giving the field's unit size in milliseconds as intended.

The 'getUnitMillis' method yields 'this.iUnitMillis' in the mutant version. Since 'iUnitMillis' is already a class instance variable, adding 'this' is unnecessary, and doing so has no effect on the method's behavior or output.",1.71909E+12,1.71909E+12,0,2,0,2,no,0/2/0
120,1121,1,SUBMITTED,no,"added parenthesis, no change",1.71856E+12,1.71856E+12,0,2,0,2,no,0/2/0
116,1121,8,SUBMITTED,no,Adding parenthesis in the mutant code does not change the functionality or result of the division.,1.71863E+12,1.71864E+12,0,2,0,2,no,0/2/0
11,1122,1,SUBMITTED,no,The formating doesn't change the code functionality,1.71923E+12,1.71923E+12,0,2,0,2,no,0/2/0
129,1122,1,SUBMITTED,no,"Indentation doesn't affect code behavior or functionality, nor does placing a closing parenthesis (curly brace) further away or closer to the ending statement.",1.71934E+12,1.71934E+12,0,2,0,2,no,0/2/0
97,1123,1,SUBMITTED,no,they have the same output because casting an int as an int has no effect,1.71878E+12,1.71878E+12,0,2,0,2,no,0/2/0
14,1123,1,SUBMITTED,no,"typecasting to int before putting it in int variable, does not change the value",1.71828E+12,1.71828E+12,0,2,0,2,no,0/2/0
126,1133,1,SUBMITTED,no,There's no difference in behavior or output.  Both code snippets receive same parameters both in different order and that in itself doesn't impact the outcome. ,1.71916E+12,1.71916E+12,0,2,0,2,no,0/2/0
11,1133,3,SUBMITTED,no,swapping operands in the addition or multiplication operation doesn't change the code outputs,1.71923E+12,1.71923E+12,0,2,0,2,no,0/2/0
17,1135,1,SUBMITTED,yes,Function requires milliseconds value,1.71891E+12,1.71891E+12,0,0,2,2,yes,0/0/2
126,1135,1,SUBMITTED,yes,"Code snippet 1:
This snippet calls the method getWrappedField().getMillis(scaled) and returns its result.

Code snippet 2:
Simply returns the value of the scaled variable.",1.71901E+12,1.71901E+12,0,0,2,2,yes,0/0/2
122,1138,1,SUBMITTED,yes,"The overridden public long getUnitMillis() function should return units in millis after multiplying with some scalar, while the mutant version only returns that scalar without acting on the getUnitMillis() functionality. Hence it's a clear bug.",1.71892E+12,1.71892E+12,0,0,3,3,yes,0/0/3
106,1138,1,SUBMITTED,yes,"the original and mutant return completely different things because the original returns getWrappedField().getUnitMillis() * iScalar, while the mutant returns only iScalar.",1.71893E+12,1.71893E+12,0,0,3,3,yes,0/0/3
11,1138,3,SUBMITTED,yes,Removing this getWrappedField().getUnitMillis() from the return value will affect the output of the return ,1.71923E+12,1.71923E+12,0,0,3,3,yes,0/0/3
11,1139,5,SUBMITTED,yes,The main code checks if the object locale and the instance object are either have the same reference or the same vale while the mutant just checks is they have the same reference but they might have the same value,1.7193E+12,1.7193E+12,0,0,2,2,yes,0/0/2
17,1139,4,SUBMITTED,yes,Mutant relaxes conditional strictness,1.71891E+12,1.71891E+12,0,0,2,2,yes,0/0/2
97,1140,1,SUBMITTED,no,its the same code,1.71903E+12,1.71903E+12,0,2,0,2,no,0/2/0
126,1140,1,SUBMITTED,no,There isn’t anything to compare.,1.71919E+12,1.71919E+12,0,2,0,2,no,0/2/0
17,1143,1,SUBMITTED,no,Mutant is a reformat without code changes,1.71932E+12,1.71932E+12,0,3,0,3,no,0/3/0
23,1143,2,SUBMITTED,no,The mutant is a formatted version of the actual code snippet. Hense its NOT buggy.,1.71925E+12,1.71925E+12,0,3,0,3,no,0/3/0
120,1143,1,SUBMITTED,no,changed spacing,1.71861E+12,1.71861E+12,0,3,0,3,no,0/3/0
116,1145,2,SUBMITTED,no,"There is nothing to compare, raised issue in Github",1.71926E+12,1.71926E+12,0,2,0,2,no,0/2/0
63,1145,2,SUBMITTED,no,The mutant is just a reformatting of the original code.,1.71909E+12,1.71909E+12,0,2,0,2,no,0/2/0
132,1149,12,SUBMITTED,no,"There is just an extra pair of brakets , it took me this time cause i was searching for the methods in their original  classes so i can understand the flow of this function , and i didnt notice that the mutation was this easy :)",1.71924E+12,1.71924E+12,0,2,0,2,no,0/2/0
126,1149,1,SUBMITTED,no,"There's no difference in output or behavior in the Java code snippets. 
 The extra parentheses in code snippet 2 is redundant and does not affect the output of its operation. ",1.71897E+12,1.71897E+12,0,2,0,2,no,0/2/0
17,1156,1,SUBMITTED,no,The DateTime cast is not required since withMillis returns a DateTime object,1.71919E+12,1.71919E+12,0,2,0,2,no,0/2/0
125,1156,3,SUBMITTED,no,"The mutant code casts the return statement to a DateTime, which it already is; this doesn't affect the behavior compared to the original code.",1.7192E+12,1.7192E+12,0,2,0,2,no,0/2/0
97,1158,1,SUBMITTED,no,it is like casting an int as an int,1.71893E+12,1.71893E+12,0,2,0,2,no,0/2/0
120,1158,1,SUBMITTED,no,formatting difference,1.71923E+12,1.71923E+12,0,2,0,2,no,0/2/0
126,1163,1,SUBMITTED,no,"There's difference in the formatting of the closing brace. However, both code snippets are valid and there's no overall change in behavior or output on both ends.",1.71856E+12,1.71856E+12,0,3,0,3,no,0/3/0
14,1163,1,SUBMITTED,no,same code with spacing change,1.71916E+12,1.71916E+12,0,3,0,3,no,0/3/0
122,1163,1,SUBMITTED,no,"This is clearly correct, as the change only introduces an unintended closing curly brace. The functionality remains exactly the same. ",1.71892E+12,1.71892E+12,0,3,0,3,no,0/3/0
11,1165,2,SUBMITTED,no,Adding this. doesn't affect the code ,1.71923E+12,1.71923E+12,0,2,0,2,no,0/2/0
120,1165,1,SUBMITTED,no,no difference when this is not parameter in function,1.71926E+12,1.71927E+12,0,2,0,2,no,0/2/0
11,1167,1,SUBMITTED,no,Adding extra brackets doesn't affect the code,1.7193E+12,1.7193E+12,0,2,0,2,no,0/2/0
126,1167,1,SUBMITTED,no,"Both code snippets checks if thisMillis > otherMillis.
The extra parentheses in code snippet two has no impact on the output of code snippet two.",1.71915E+12,1.71915E+12,0,2,0,2,no,0/2/0
120,1169,1,SUBMITTED,no,changed spacing,1.71861E+12,1.71861E+12,0,3,0,3,no,0/3/0
126,1169,1,SUBMITTED,no,"The behavior and output of both Java code snippets will be same.
The parenthesis at the end of code snippet 2 (which is absent in code snippet 1) does not impact on the overall output code snippet 2.",1.71898E+12,1.71898E+12,0,3,0,3,no,0/3/0
125,1169,2,SUBMITTED,no,"The code is the same. The only difference is the spacing and format; since the code is the same within the brackets, they have the same functionality despite the style or formatting of the code.",1.71904E+12,1.71904E+12,0,3,0,3,no,0/3/0
14,1170,1,SUBMITTED,no,typecasting int to int,1.71916E+12,1.71916E+12,0,2,0,2,no,0/2/0
11,1170,3,SUBMITTED,no,Casting doesn't affect the return value,1.71917E+12,1.71917E+12,0,2,0,2,no,0/2/0
105,1179,10,SUBMITTED,maybe,"Depending on how the parse function is implemented in the TreeBuilder class, the mutant version of the parseInput method introduces a potential change in behavior that might or might not result in a bug.

The parseInput method in the original class is implemented as follows. Nevertheless, the second parseInput method in the mutant version has been altered to cast the parse method's output to Document.

The explicit cast to Document is the primary distinction in this case. If TreeBuilder's parse method consistently yields an object of type Document, then the cast is unnecessary and has no effect on the behavior. Nevertheless, this cast might introduce a ClassCastException, leading to a runtime problem in any case where parse could return a different type (for example, a subclass of Document or another type entirely).",1.71875E+12,1.71875E+12,2,0,0,2,maybe,2/0/0
106,1179,5,SUBMITTED,maybe,"if the statement without the casting isn't a Document data type then , it would be buggy and the mutant would differ from the original ode, but if it is then they are basically the same thing ",1.71901E+12,1.71901E+12,2,0,0,2,maybe,2/0/0
66,1180,25,SUBMITTED,yes,"yes indeed buggy because it appends 2 times the valueinsertNode(doctypeNode, d)",1.71896E+12,1.71896E+12,0,0,2,2,yes,0/0/2
17,1180,1,SUBMITTED,yes,Changes logic in function,1.71891E+12,1.71891E+12,0,0,2,2,yes,0/0/2
116,1183,12,SUBMITTED,yes,The mutant does not perform a check on num before accessing the list,1.71937E+12,1.71937E+12,0,0,2,2,yes,0/0/2
133,1183,7,SUBMITTED,yes,"In the mutated case, the condition that checks if num is positive has been removed and ( (Evaluator)evaluators.get((num - 1)) ) is always returned. For instance, whether num > 0 or num < 0, the evaluator always gets returned. Thus, the behavior of the code in the mutated case has been changed and a bug has been introduced.",1.71937E+12,1.71937E+12,0,0,2,2,yes,0/0/2
17,1186,1,SUBMITTED,no,Mutant is a refactor without code changes.,1.7193E+12,1.71932E+12,0,2,0,2,no,0/2/0
14,1186,1,SUBMITTED,no,returns same object.,1.71916E+12,1.71916E+12,0,2,0,2,no,0/2/0
14,1187,1,SUBMITTED,no,typecasted to same type,1.71923E+12,1.71923E+12,0,2,0,2,no,0/2/0
126,1187,1,SUBMITTED,no,"There is no change in behavior or output between the code snippets.
The explicit type casting for code snippet 2 is redundant as the return type for the outputSettings() method is already defined to be of type outputSettings",1.71901E+12,1.71901E+12,0,2,0,2,no,0/2/0
97,1188,1,SUBMITTED,no,they both work the same. using 'this' just specifies it,1.71898E+12,1.71898E+12,0,2,0,2,no,0/2/0
126,1188,2,SUBMITTED,no,Both code snippets will  return the outputSettings instance variable. The only difference is the explicit use of this in code snippet 2  which is redundant or optional and does not impact the output.,1.71924E+12,1.71924E+12,0,2,0,2,no,0/2/0
120,1189,1,SUBMITTED,no,formatting,1.71902E+12,1.71902E+12,0,2,0,2,no,0/2/0
63,1189,1,SUBMITTED,no,The mutant is just a reformatting of the original code.,1.71896E+12,1.71896E+12,0,2,0,2,no,0/2/0
14,1191,2,SUBMITTED,yes,Null is returned instead of object.,1.71822E+12,1.71822E+12,0,0,2,2,yes,0/0/2
126,1191,1,SUBMITTED,yes,Both code snippets returns different values.,1.71916E+12,1.71916E+12,0,0,2,2,yes,0/0/2
27,1195,10,SUBMITTED,no,"The change in the code is the addition of the 'final' keyword to the owner variable. The ‘final’ keyword in Java indicates that the variable ‘owner’ cannot be reassigned after its initial assignment. In this context, it ensures that the ‘owner’ variable will always refer to the same Document object throughout its scope. The behavior of the code does not change due to this modification. The value of ‘owner’ is set to node.ownerDocument() in both cases, and the subsequent logic (return owner != null ? owner.outputSettings() : (new Document("""")).outputSettings();) remains unaffected. The introduction of the ‘final’ keyword does not alter the functionality or the output of the code. Therefore, the mutant is not buggy.
",1.71903E+12,1.71903E+12,0,2,0,2,no,0/2/0
116,1195,10,SUBMITTED,no,"Using the ""final"" keyword does not make the code buggy, instead, it ensures that the value of the variable is not changed after its initial assignment.",1.71822E+12,1.71863E+12,0,2,0,2,no,0/2/0
11,1196,1,SUBMITTED,no,Casting here wont affect the code result,1.71917E+12,1.71917E+12,0,2,0,2,no,0/2/0
17,1196,1,SUBMITTED,no,Unnecessary object type cast,1.71917E+12,1.71917E+12,0,2,0,2,no,0/2/0
126,1200,2,SUBMITTED,yes,"Code snippet 1 only returns a variable while in code snippet 2 you are accessing the class field, not a local variable or a parameter with the same name.",1.71915E+12,1.71915E+12,0,2,1,3,no,0/2/1
14,1200,1,SUBMITTED,no,same attribute is returned,1.71898E+12,1.71898E+12,0,2,1,3,no,0/2/1
17,1200,3,SUBMITTED,no,The expressions are identical,1.7194E+12,1.7194E+12,0,2,1,3,no,0/2/1
14,1201,2,SUBMITTED,yes,"if valueSep is less than 10 it will return false, which is wrong. ",1.71925E+12,1.71925E+12,0,0,2,2,yes,0/0/2
120,1201,1,SUBMITTED,yes,condition changed,1.71861E+12,1.71861E+12,0,0,2,2,yes,0/0/2
17,1205,1,SUBMITTED,no,Expressions are identical,1.71933E+12,1.71933E+12,0,2,0,2,no,0/2/0
129,1205,2,SUBMITTED,no,"The method's (where the line is mutated) parameter's doesn't include an ""array"" variable, so having and not having ""this"" won't make a difference.",1.71925E+12,1.71925E+12,0,2,0,2,no,0/2/0
11,1206,6,SUBMITTED,yes,The return value will depend on nextCalled variable ,1.71931E+12,1.71931E+12,0,0,2,2,yes,0/0/2
97,1206,5,SUBMITTED,yes,"It is sometimes buggy. if 'beforeFirst' is false, 'removed' is false, and 'nextCalled' is false, then both codes wont hae the same responce",1.71856E+12,1.71856E+12,0,0,2,2,yes,0/0/2
126,1208,2,SUBMITTED,yes,"Let's  assume 
beforeFirst = false and removed = false

Code snippet 1:
The code does logical AND on !beforeFirst and  !removed and the result will be true given our prior reference assumption.

Code snippet 2:

The Code does logical OR operation on two 'parent logical operations' I.e
(!beforeFirst && !removed) || (!beforeFirst || removed
From the above code, parent logical operation to the right will evaluates its AND operation to give true which will then be ORed with the true value gotten from the second parent logical operation to the right. We have True OR true which gives true.

Summary, the overall conditions checks shows a clear difference in behavior which can lead to difference in output.",1.71901E+12,1.71901E+12,0,0,2,2,yes,0/0/2
116,1208,15,SUBMITTED,yes,The mutant is buggy because it incorrectly allows conditions where beforeFirst is true and removed is true to return true,1.71929E+12,1.71929E+12,0,0,2,2,yes,0/0/2
116,1209,10,SUBMITTED,no,It functions better than the first code,1.7191E+12,1.7191E+12,0,2,0,2,no,0/2/0
23,1209,15,SUBMITTED,no,"The original code could be considered buggy if there are situations where this.composite could be EMPTY_MAP_ARRAY. In such cases, accessing this.composite[i] would be invalid and could lead to an ArrayIndexOutOfBoundsException or other logical errors.

The change improves the robustness of the method by ensuring that it only attempts to access elements of this.composite if it is not EMPTY_MAP_ARRAY. Therefore, the modification appears to fix a potential bug and makes the code safer.

So, the modified code is less likely to be buggy compared to the original code.",1.71812E+12,1.71855E+12,0,2,0,2,no,0/2/0
97,1210,2,SUBMITTED,yes,they both don't work the same when 'this.composite[i]' is not empty but contains the key,1.71908E+12,1.71908E+12,0,0,2,2,yes,0/0/2
14,1210,3,SUBMITTED,yes,"when  expression after && is false, and expression before && is true, returns wrong result",1.71839E+12,1.71839E+12,0,0,2,2,yes,0/0/2
127,1211,3,SUBMITTED,yes,"The loop in the original code continues as long as ""i >= 0"", but the loop in the mutant only continues when ""i == 0"". These two loops have the same behavior only when ""this.composite.length"" is 1. So, the mutant is a bug.",1.71877E+12,1.71877E+12,0,0,2,2,yes,0/0/2
14,1211,1,SUBMITTED,yes,Loop only works perferctly for 1.,1.71847E+12,1.71847E+12,0,0,2,2,yes,0/0/2
126,1222,1,SUBMITTED,yes,"Code snippet 1 does a single if check while code snippet 2 does two if conditional checks.
This results in difference in behavior as well as output in both code snippets.",1.71919E+12,1.71919E+12,0,0,2,2,yes,0/0/2
116,1222,12,SUBMITTED,yes, The double check of iterator instanceof ListIterator in the Mutant code is unnecessary and could lead to confusion or logical errors.,1.7191E+12,1.7191E+12,0,0,2,2,yes,0/0/2
17,1223,3,SUBMITTED,yes,Mutant changes code logic,1.71921E+12,1.71921E+12,0,2,1,3,no,0/2/1
132,1223,4,SUBMITTED,no,"the if condition will keep working the same , if True then it will just be True AND (anything OR True) which is True , and if False , then False AND anything is just False",1.71906E+12,1.71906E+12,0,2,1,3,no,0/2/1
127,1223,3,SUBMITTED,no,"If ""iterator"" is an instance of ""ListIterator"", the ""if"" condition in the original code will be True. For the mutated code, the left side of the bitwise AND will be True, and so will the right side since no matter whether ""currentIndex == wrappedIteratorIndex"", the right side of the OR is already True, so the whole condition will evaluate to True. If ""iterator"" is not an instance of ""ListIterator"", the ""if"" conditions in both cases will be False. So, the mutant is not a bug.",1.71872E+12,1.71872E+12,0,2,1,3,no,0/2/1
11,1224,5,SUBMITTED,no,This expression && (currentIndex == 0 || iterator instanceof ListIterator)) will always be the same as the main code result as the || iterator instanceof ListIterator will be the same as in the main code so the results depends only to that expression  iterator instanceof ListIterator like in the main code,1.7193E+12,1.7193E+12,0,2,0,2,no,0/2/0
14,1224,2,SUBMITTED,no,if iterator instanceof ListIterator expression in mutant has same value .,1.71925E+12,1.71925E+12,0,2,0,2,no,0/2/0
14,1228,3,SUBMITTED,no,"If the object is in array[1], then mutant will return false which is wrong",1.71916E+12,1.71916E+12,0,1,2,3,yes,0/1/2
63,1228,15,SUBMITTED,yes,"The mutant introduces an extra OR condition with the expression (objectToFind.equals(array[ 0]). In case the array variable is null, indexOf method will return CollectionUtils.INDEX_NOT_FOUND, meaning the first condition will be false. When evaluating the second condition, it will look for the 0th object in an array that is null resulting in a NullPointerException. The original code does not have the extra condition is null-safe. Therefore, the mutant is buggy and has a different functionality.",1.71909E+12,1.71909E+12,0,1,2,3,yes,0/1/2
120,1228,3,SUBMITTED,yes,additional condition,1.71899E+12,1.71899E+12,0,1,2,3,yes,0/1/2
52,1232,2,SUBMITTED,no,I think it will do the same functionality but the addition of !(null == this) is somewhat confusing as this will not be null so I think it will not effect and will be unnecessary. ,1.71934E+12,1.71934E+12,0,2,0,2,no,0/2/0
17,1232,3,SUBMITTED,no,The mutant addition will never evaluate to true because of earlier if statements in the function,1.7194E+12,1.7194E+12,0,2,0,2,no,0/2/0
14,1233,2,SUBMITTED,no,"case by case analysis shows, mutant and source are equivalent",1.71925E+12,1.71925E+12,0,3,0,3,no,0/3/0
120,1233,1,SUBMITTED,no,added condition same as old,1.71903E+12,1.71903E+12,0,3,0,3,no,0/3/0
106,1233,2,SUBMITTED,no,"when the mutant's equvence equation is expanded out then it represents the original equivalence equation but just twice, so therefore they equal the same thing",1.7192E+12,1.7192E+12,0,3,0,3,no,0/3/0
14,1237,2,SUBMITTED,no,"null!= object is always true at that line, so && null!= object will not change execution",1.71916E+12,1.71916E+12,0,2,1,3,no,0/2/1
126,1237,2,SUBMITTED,yes,"Code snippet 1 checks only one condition i.e it checks if the class of object is equal to the class of this. Code snippet 2 checks two conditions:
1) If the class of object is equal to the class of this.
2) If object is not null.
Given the above, there's a difference in behavior as well as output on both ends.",1.71857E+12,1.71857E+12,0,2,1,3,no,0/2/1
123,1237,4,SUBMITTED,no,"The code behavior doesn't change as the object will never be null. The reason for this is because we check in a prior if statement, which returns false if the object is null",1.71915E+12,1.71915E+12,0,2,1,3,no,0/2/1
14,1239,3,SUBMITTED,yes,"when get.containsValue(value) is true and get instanceof IterableGet is true, returns false instead of true",1.71839E+12,1.71839E+12,0,0,2,2,yes,0/0/2
126,1239,2,SUBMITTED,yes,"code snippe 1 checks for the presence of the value only while code
Snippet 2 checks for the presence of the value and ensures get is not an instance of IterableGet.",1.71898E+12,1.71898E+12,0,0,2,2,yes,0/0/2
14,1241,3,SUBMITTED,yes,depends on the concrete class of get,1.71925E+12,1.71925E+12,0,0,2,2,yes,0/0/2
11,1241,4,SUBMITTED,yes,"This expression && !(get instanceof IterableGet) will always be false as the variable get is instance of iterableGet, so the return value will always be false",1.71917E+12,1.71917E+12,0,0,2,2,yes,0/0/2
11,1243,2,SUBMITTED,yes,The mutant check if the arg is not null then clone the variable paramTypes that might be null,1.71915E+12,1.71915E+12,0,0,2,2,yes,0/0/2
